{
  "deck_id": "multi-system-market-atlas-infographic",
  "scores": {
    "fidelity": 95.65,
    "editability": 100.0,
    "design": 95,
    "practicality": 0
  },
  "blocking_issues": [],
  "objects_audited": [
    {
      "slide_id": "ls01",
      "id": "ls01_bg",
      "role": "atlas-canvas",
      "type": "shape",
      "priority": 1,
      "expected": "native",
      "actual": "native-shape",
      "pass": true,
      "note": ""
    },
    {
      "slide_id": "ls01",
      "id": "ls01_grid_h_118",
      "role": "atlas-gridline",
      "type": "shape",
      "priority": 1,
      "expected": "native",
      "actual": "native-shape",
      "pass": true,
      "note": ""
    },
    {
      "slide_id": "ls01",
      "id": "ls01_grid_h_222",
      "role": "atlas-gridline",
      "type": "shape",
      "priority": 1,
      "expected": "native",
      "actual": "native-shape",
      "pass": true,
      "note": ""
    },
    {
      "slide_id": "ls01",
      "id": "ls01_grid_h_326",
      "role": "atlas-gridline",
      "type": "shape",
      "priority": 1,
      "expected": "native",
      "actual": "native-shape",
      "pass": true,
      "note": ""
    },
    {
      "slide_id": "ls01",
      "id": "ls01_grid_h_430",
      "role": "atlas-gridline",
      "type": "shape",
      "priority": 1,
      "expected": "native",
      "actual": "native-shape",
      "pass": true,
      "note": ""
    },
    {
      "slide_id": "ls01",
      "id": "ls01_grid_h_534",
      "role": "atlas-gridline",
      "type": "shape",
      "priority": 1,
      "expected": "native",
      "actual": "native-shape",
      "pass": true,
      "note": ""
    },
    {
      "slide_id": "ls01",
      "id": "ls01_grid_h_638",
      "role": "atlas-gridline",
      "type": "shape",
      "priority": 1,
      "expected": "native",
      "actual": "native-shape",
      "pass": true,
      "note": ""
    },
    {
      "slide_id": "ls01",
      "id": "ls01_grid_v_1040",
      "role": "atlas-gridline",
      "type": "shape",
      "priority": 1,
      "expected": "native",
      "actual": "native-shape",
      "pass": true,
      "note": ""
    },
    {
      "slide_id": "ls01",
      "id": "ls01_grid_v_1200",
      "role": "atlas-gridline",
      "type": "shape",
      "priority": 1,
      "expected": "native",
      "actual": "native-shape",
      "pass": true,
      "note": ""
    },
    {
      "slide_id": "ls01",
      "id": "ls01_grid_v_240",
      "role": "atlas-gridline",
      "type": "shape",
      "priority": 1,
      "expected": "native",
      "actual": "native-shape",
      "pass": true,
      "note": ""
    },
    {
      "slide_id": "ls01",
      "id": "ls01_grid_v_400",
      "role": "atlas-gridline",
      "type": "shape",
      "priority": 1,
      "expected": "native",
      "actual": "native-shape",
      "pass": true,
      "note": ""
    },
    {
      "slide_id": "ls01",
      "id": "ls01_grid_v_560",
      "role": "atlas-gridline",
      "type": "shape",
      "priority": 1,
      "expected": "native",
      "actual": "native-shape",
      "pass": true,
      "note": ""
    },
    {
      "slide_id": "ls01",
      "id": "ls01_grid_v_720",
      "role": "atlas-gridline",
      "type": "shape",
      "priority": 1,
      "expected": "native",
      "actual": "native-shape",
      "pass": true,
      "note": ""
    },
    {
      "slide_id": "ls01",
      "id": "ls01_grid_v_80",
      "role": "atlas-gridline",
      "type": "shape",
      "priority": 1,
      "expected": "native",
      "actual": "native-shape",
      "pass": true,
      "note": ""
    },
    {
      "slide_id": "ls01",
      "id": "ls01_grid_v_880",
      "role": "atlas-gridline",
      "type": "shape",
      "priority": 1,
      "expected": "native",
      "actual": "native-shape",
      "pass": true,
      "note": ""
    },
    {
      "slide_id": "ls01",
      "id": "ls01_route_primary",
      "role": "route-line",
      "type": "shape",
      "priority": 2,
      "expected": "native",
      "actual": "native-shape",
      "pass": true,
      "note": ""
    },
    {
      "slide_id": "ls01",
      "id": "ls01_route_secondary",
      "role": "route-line",
      "type": "shape",
      "priority": 2,
      "expected": "native",
      "actual": "native-shape",
      "pass": true,
      "note": ""
    },
    {
      "slide_id": "ls01",
      "id": "ls01_node_1",
      "role": "map-node",
      "type": "shape",
      "priority": 2,
      "expected": "native",
      "actual": "native-shape",
      "pass": true,
      "note": ""
    },
    {
      "slide_id": "ls01",
      "id": "ls01_node_2",
      "role": "map-node",
      "type": "shape",
      "priority": 2,
      "expected": "native",
      "actual": "native-shape",
      "pass": true,
      "note": ""
    },
    {
      "slide_id": "ls01",
      "id": "ls01_node_3",
      "role": "map-node",
      "type": "shape",
      "priority": 2,
      "expected": "native",
      "actual": "native-shape",
      "pass": true,
      "note": ""
    },
    {
      "slide_id": "ls01",
      "id": "ls01_zone_bottom",
      "role": "background",
      "type": "shape",
      "priority": 1,
      "expected": "native",
      "actual": "native-shape",
      "pass": true,
      "note": ""
    },
    {
      "slide_id": "ls01",
      "id": "ls01_zone_left",
      "role": "background",
      "type": "shape",
      "priority": 1,
      "expected": "native",
      "actual": "native-shape",
      "pass": true,
      "note": ""
    },
    {
      "slide_id": "ls01",
      "id": "ls01_zone_right",
      "role": "background",
      "type": "shape",
      "priority": 1,
      "expected": "native",
      "actual": "native-shape",
      "pass": true,
      "note": ""
    },
    {
      "slide_id": "ls01",
      "id": "ls01_folio",
      "role": "research-folio",
      "type": "text",
      "priority": 2,
      "expected": "native",
      "actual": "native-text",
      "pass": true,
      "note": ""
    },
    {
      "slide_id": "ls01",
      "id": "ls01_legend_1",
      "role": "research-folio",
      "type": "text",
      "priority": 2,
      "expected": "native",
      "actual": "native-text",
      "pass": true,
      "note": ""
    },
    {
      "slide_id": "ls01",
      "id": "ls01_legend_2",
      "role": "research-folio",
      "type": "text",
      "priority": 2,
      "expected": "native",
      "actual": "native-text",
      "pass": true,
      "note": ""
    },
    {
      "slide_id": "ls01",
      "id": "ls01_kicker",
      "role": "kicker",
      "type": "text",
      "priority": 4,
      "expected": "native",
      "actual": "native-text",
      "pass": true,
      "note": ""
    },
    {
      "slide_id": "ls01",
      "id": "ls01_title",
      "role": "title",
      "type": "text",
      "priority": 5,
      "expected": "native",
      "actual": "native-text",
      "pass": true,
      "note": ""
    },
    {
      "slide_id": "ls01",
      "id": "ls01_subtitle",
      "role": "body",
      "type": "text",
      "priority": 5,
      "expected": "native",
      "actual": "native-text",
      "pass": true,
      "note": ""
    },
    {
      "slide_id": "ls01",
      "id": "ls01_body_1",
      "role": "body",
      "type": "text",
      "priority": 5,
      "expected": "native",
      "actual": "native-text",
      "pass": true,
      "note": ""
    },
    {
      "slide_id": "ls01",
      "id": "ls01_body_2",
      "role": "body",
      "type": "text",
      "priority": 5,
      "expected": "native",
      "actual": "native-text",
      "pass": true,
      "note": ""
    },
    {
      "slide_id": "ls01",
      "id": "ls01_metric_1_chip",
      "role": "signal-chip",
      "type": "shape",
      "priority": 3,
      "expected": "native",
      "actual": "native-shape",
      "pass": true,
      "note": ""
    },
    {
      "slide_id": "ls01",
      "id": "ls01_metric_1_label",
      "role": "metric-label",
      "type": "text",
      "priority": 4,
      "expected": "native",
      "actual": "native-text",
      "pass": true,
      "note": ""
    },
    {
      "slide_id": "ls01",
      "id": "ls01_metric_1_value",
      "role": "metric",
      "type": "text",
      "priority": 5,
      "expected": "native",
      "actual": "native-text",
      "pass": true,
      "note": ""
    },
    {
      "slide_id": "ls01",
      "id": "ls01_metric_1_delta",
      "role": "metric-note",
      "type": "text",
      "priority": 4,
      "expected": "native",
      "actual": "native-text",
      "pass": true,
      "note": ""
    },
    {
      "slide_id": "ls01",
      "id": "ls01_metric_2_chip",
      "role": "signal-chip",
      "type": "shape",
      "priority": 3,
      "expected": "native",
      "actual": "native-shape",
      "pass": true,
      "note": ""
    },
    {
      "slide_id": "ls01",
      "id": "ls01_metric_2_label",
      "role": "metric-label",
      "type": "text",
      "priority": 4,
      "expected": "native",
      "actual": "native-text",
      "pass": true,
      "note": ""
    },
    {
      "slide_id": "ls01",
      "id": "ls01_metric_2_value",
      "role": "metric",
      "type": "text",
      "priority": 5,
      "expected": "native",
      "actual": "native-text",
      "pass": true,
      "note": ""
    },
    {
      "slide_id": "ls01",
      "id": "ls01_metric_2_delta",
      "role": "metric-note",
      "type": "text",
      "priority": 4,
      "expected": "native",
      "actual": "native-text",
      "pass": true,
      "note": ""
    },
    {
      "slide_id": "ls01",
      "id": "ls01_metric_3_chip",
      "role": "signal-chip",
      "type": "shape",
      "priority": 3,
      "expected": "native",
      "actual": "native-shape",
      "pass": true,
      "note": ""
    },
    {
      "slide_id": "ls01",
      "id": "ls01_allocation_route_spine",
      "role": "route-line",
      "type": "shape",
      "priority": 2,
      "expected": "native",
      "actual": "native-shape",